{
  "name": "status",
  "kind": "enum",
  "value": "Active",
  "previousValue": null,
  "provenance": {
    "current": {
      "source": "Conversation",
      "confidence": 0.9,
      "note": "Literally present in the turn: status",
      "at": "2026-09-04T09:00:00.000Z",
      "conversationTurn": null,
      "binding": null
    },
    "prior": []
  },
  "isMandatory": true
}
